{
  "autonomy_requested": "L2",
  "capability": "autonomy.review",
  "correlation_id": "corr-1790851492",
  "created_at": "2026-10-01T10:44:52.008Z",
  "from": "system",
  "idempotency": {
    "attempt": 1,
    "class": "none",
    "components": [
      "agent",
      "capability"
    ]
  },
  "input": {
    "agent": "test-agent-5",
    "capability": "log.compact",
    "clean_runs": 24,
    "current_level": "L2",
    "evidence_window": 30,
    "reason": "Conditions not yet satisfied: clean_runs=24/30, shadow_agreement=0.0% (n=0/20)",
    "reviewed_at": "2026-10-01T10:44:52.007Z",
    "shadow_agreement": 0.0,
    "shadow_n": 0,
    "sim_status": "pass",
    "verdict": "hold"
  },
  "input_provenance": [
    {
      "content_hash": "sha256:0",
      "field": "$",
      "source": "autonomy-evaluator",
      "trust": "internal"
    }
  ],
  "priority": "normal",
  "schema_version": "2.0.0",
  "task_id": "task-review-test-agent-5-1790851492",
  "to": "orchestrator",
  "transport": "T1",
  "world": "prod"
}
